{
  "record_format_version": "1.0",
  "runtime_version": "1.1",
  "artifact_id": "ha_st_hs_pytorch_torch_batch_norm_update_stats_bug_aware_static_hsr006_r2_0def3d5da005",
  "generation_key": "0def3d5da005e63c3b7676691e50e2a77bbd5638f8428ae6793364ecdad766b8",
  "snapshot_kind": "final",
  "snapshot_interval": 65536,
  "site_count": 29,
  "started_iterations": 38850,
  "finished_iterations": 38850,
  "unwound_iterations": 0,
  "invalid_site_records": 0,
  "export_failures": 0,
  "site_counts": [
    19674,
    19674,
    19674,
    19674,
    9356,
    10318,
    10318,
    0,
    0,
    0,
    10318,
    0,
    10318,
    19175,
    19175,
    4048,
    15127,
    15127,
    15127,
    5589,
    0,
    0,
    15127,
    5589,
    0,
    0,
    15127,
    5589,
    9538
  ]
}
