{
  "record_format_version": "1.0",
  "runtime_version": "1.1",
  "artifact_id": "ha_st_hs_pytorch_torch_nn_functional_cosine_embedding_loss_bug_aware_static_hsr004_r2_1db0a08e49f6",
  "generation_key": "1db0a08e49f69e4489ece5f762fe5ed1aad0e4e9aed94bea497d5acd0c136c5b",
  "snapshot_kind": "final",
  "snapshot_interval": 65536,
  "site_count": 46,
  "started_iterations": 16322,
  "finished_iterations": 16322,
  "unwound_iterations": 0,
  "invalid_site_records": 0,
  "export_failures": 0,
  "site_counts": [
    7103,
    924,
    6179,
    6179,
    6179,
    6179,
    0,
    0,
    0,
    6179,
    4188,
    0,
    0,
    6179,
    0,
    6179,
    9218,
    9218,
    9218,
    9218,
    9218,
    9218,
    6600,
    0,
    0,
    9218,
    9218,
    5645,
    0,
    0,
    9218,
    9218,
    6479,
    0,
    0,
    9218,
    6600,
    0,
    0,
    9218,
    7798,
    0,
    0,
    9218,
    4145,
    5073
  ]
}
