{
  "record_format_version": "1.0",
  "runtime_version": "1.0",
  "artifact_id": "ha_st_hs_pytorch_torch_matmul_bug_aware_static_hsr001_r1_7ae6170271c9",
  "generation_key": "7ae6170271c9aa8b0d61f1cabe0eb757347ad7b10faf72e69749319517d59e3c",
  "snapshot_kind": "final",
  "snapshot_interval": 65536,
  "site_count": 50,
  "started_iterations": 18973,
  "finished_iterations": 18973,
  "unwound_iterations": 0,
  "invalid_site_records": 0,
  "export_failures": 0,
  "site_counts": [
    7679,
    7679,
    7679,
    7679,
    0,
    0,
    0,
    7679,
    7679,
    7679,
    7679,
    0,
    11294,
    11294,
    11294,
    11294,
    11294,
    11294,
    0,
    0,
    11294,
    11294,
    11294,
    0,
    0,
    11294,
    11294,
    11294,
    0,
    0,
    11294,
    11294,
    11294,
    0,
    0,
    11294,
    11294,
    0,
    0,
    11294,
    11294,
    0,
    0,
    11294,
    11294,
    11294,
    11294,
    11294,
    11294,
    0
  ]
}
