{
  "record_format_version": "1.0",
  "runtime_version": "1.0",
  "artifact_id": "ha_st_hs_pytorch_torch_matmul_bug_aware_static_hsr002_r1_7ffe37d3f651",
  "generation_key": "7ffe37d3f651efe5d9cb846e0f4297d0b6d8665ee88d63707cd6adc4d3732daf",
  "snapshot_kind": "final",
  "snapshot_interval": 1,
  "site_count": 42,
  "started_iterations": 19,
  "finished_iterations": 19,
  "unwound_iterations": 0,
  "invalid_site_records": 0,
  "export_failures": 0,
  "site_counts": [
    9,
    9,
    9,
    9,
    9,
    9,
    9,
    0,
    10,
    10,
    10,
    10,
    10,
    10,
    0,
    0,
    10,
    10,
    10,
    0,
    0,
    10,
    10,
    10,
    0,
    0,
    10,
    10,
    10,
    0,
    0,
    10,
    10,
    0,
    0,
    10,
    10,
    10,
    10,
    10,
    10,
    0
  ]
}
